{
  "schemaVersion": 1,
  "kind": "linear-project-plan",
  "projectId": "project-1",
  "teamId": "team-1",
  "approved": false,
  "summary": "Deliver a verified onboarding baseline.",
  "assumptions": [],
  "questions": [],
  "milestones": [
    {
      "key": "demo.milestone.onboarding",
      "name": "Onboarding baseline",
      "description": "Baseline evidence is reviewed."
    }
  ],
  "resources": [
    {
      "key": "demo.resource.analytics",
      "title": "Analytics reference",
      "type": "document"
    }
  ],
  "issues": [
    {
      "key": "demo.parent.onboarding",
      "kind": "parent",
      "milestoneKey": "demo.milestone.onboarding",
      "title": "Establish onboarding baseline",
      "description": "Produce a reproducible baseline.",
      "status": "Ready",
      "priority": "high",
      "priorityRationale": "Enables later measurement.",
      "labels": ["agent:parent"],
      "acceptanceCriteria": ["Baseline and evidence URI are recorded."],
      "capabilities": ["analytics.audit"],
      "resources": ["docs:onboarding-baseline"],
      "blockedByKeys": [],
      "claimable": true
    },
    {
      "key": "demo.child.collect",
      "kind": "sub-issue",
      "parentKey": "demo.parent.onboarding",
      "milestoneKey": "demo.milestone.onboarding",
      "title": "Collect source data",
      "description": "Collect the approved source snapshot.",
      "status": "Ready",
      "priority": "high",
      "priorityRationale": "First executable evidence step.",
      "labels": ["agent:sub-issue"],
      "acceptanceCriteria": ["Snapshot timestamp and URI are recorded."],
      "capabilities": ["analytics.audit"],
      "resources": ["docs:onboarding-source"],
      "blockedByKeys": [],
      "claimable": true
    },
    {
      "key": "demo.child.report",
      "kind": "sub-issue",
      "parentKey": "demo.parent.onboarding",
      "milestoneKey": "demo.milestone.onboarding",
      "title": "Publish baseline report",
      "description": "Summarize the verified source snapshot.",
      "status": "Blocked",
      "priority": "normal",
      "priorityRationale": "Depends on source collection.",
      "labels": ["agent:sub-issue"],
      "acceptanceCriteria": ["Report cites the source snapshot."],
      "capabilities": ["analytics.reporting"],
      "resources": ["docs:onboarding-baseline"],
      "blockedByKeys": ["demo.child.collect"],
      "claimable": true
    }
  ]
}
