{
  "schemaVersion": 1,
  "kind": "linear-project-plan",
  "projectId": "example-project-id",
  "teamId": "example-team-id",
  "approved": false,
  "summary": "Prepare a measurable launch operating baseline.",
  "assumptions": [
    "The current analytics baseline has not been verified."
  ],
  "questions": [
    "Which business metric should determine launch acceptance?"
  ],
  "milestones": [
    {
      "key": "example.launch-readiness",
      "name": "Launch readiness",
      "description": "Required operational evidence is reviewed."
    }
  ],
  "resources": [
    {
      "key": "example.analytics-baseline",
      "title": "Analytics baseline",
      "type": "document"
    }
  ],
  "issues": [
    {
      "key": "example.define-launch-metric",
      "kind": "decision",
      "milestoneKey": "example.launch-readiness",
      "title": "Choose the launch acceptance metric",
      "description": "Select the business metric and baseline used for launch acceptance.",
      "status": "Refinement",
      "priority": "high",
      "priorityRationale": "Blocks measurable launch acceptance.",
      "labels": ["manager:decision"],
      "acceptanceCriteria": ["Metric, owner, source, and threshold are documented."],
      "capabilities": [],
      "resources": ["docs:launch-metric"],
      "blockedByKeys": [],
      "claimable": false
    },
    {
      "key": "example.capture-analytics-baseline",
      "kind": "parent",
      "milestoneKey": "example.launch-readiness",
      "title": "Capture the current analytics baseline",
      "description": "Produce an evidence-backed baseline for the approved launch metric.",
      "status": "Blocked",
      "priority": "high",
      "priorityRationale": "Required for measurable launch readiness.",
      "labels": ["agent:parent", "area:analytics"],
      "acceptanceCriteria": ["Baseline source and timestamp are documented.", "Evidence URL is attached."],
      "capabilities": ["analytics.audit"],
      "resources": ["docs:analytics-baseline"],
      "blockedByKeys": ["example.define-launch-metric"],
      "claimable": true
    }
  ]
}
